subreddit,title,text,url,created,keyword,score
IsraelPalestine,The Great Big Lie: How the West Distorted the Conflict,"My thesis here is simple: the entire narrative about the conflict is a big lie, distorted over years by the west. The conflict is not about land, a Palestinian state, or about a nakba or oppression. Instead it is and has always been about Jews having a homeland in their indigenous land, and the conflict is not about borders or settlements but about whether Israel can exist at all. 

________

Some indisputable facts: 

1) Jews are not just a religion but an ancient people who have survived thousands of years despite numerous attempts by the general world to either assimilate them or kill them off. 

Examples included: Greeks, Romans, Naz!s, Russians, Spanish Christians, and many more. 

2) The Jews hail from this land. Archeology proves this beyond a shadow of a doubt, and Jews have had continuous presence in the land (sometimes really small) for thousands of years. 

_____

Now let’s chat about some history: 

At the turn of the 19th century as antisemitism began to raise its evil head, Zionism was born. If you read Herzl, his idea was simple. 

The world hates Jews. They prefer to not associate with Jews. Let the world give the Jews a parcel of land, and allow the Jews to get out of everyone’s hair. Jews would become self governed, live far away from everyone and participate in world affairs only to the degree that the world wants to cooperate and with whom the world wants to do so. Jews who have money would help fund migration to the Jewish land, and Jews would live and let live. 

That is all this was about, and frankly I believe all most of us Jews really want. Leave us alone. Let us do our thing and stop trying to kill us, or blame us for all your misery and misfortunes. 

It was not some colonialism project of taking over the world, or trying to disrupt religions. Jews are one of the few religions where we don’t even want people to join us, and don’t participate in any missionary activities. 

To this degree, the idea initially was to have any piece of land, but if Herzl could have his way, then the home land of Israel (currently part of the Ottoman Empire and mostly run down deserted dessert) would of course be preferable since it is after all where our people come from, our home land, and our ancestors place.

Jews began purchasing land in modern day israel, often purchasing from the Ottomans or local Arab population, and began to slowly migrate back home. 

————-

With WWI and the collapse of the Ottoman Empire the world map needed to be redrawn. This isn’t a new concept… over thousands of years, as one empire or another collapsed the world powers or victors recrafted the map and borders. In this case, the predecessor of the UN (League of Nations) tasked Great Britain with the Job of administering a chunk of the land called the Mandate for Palestine. 

This included: Lebanon, Israel, Gaza, Syria, Jordan. The mandate also instructed Britain to uphold the “Balfour Declaration” which was first agreed upon by Britain in the early stages of WWI which promised Jews a state in the land (still under Ottoman control). 

Of course one could argue “who were the British to even decide this…. And who gives the League of Nations the right to decide what to do with the land…. 

But throughout history this is exactly how it always worked. Countries, kingdoms, Empires came and went, and the powerful nations decided what to do when a state failed. We are literally witnessing this right now with Syria after the Assad regime collapsed, and the world powers seem to recognize the rebel X ISIS fighters as the new government of Syria! 

Yes, Arabs existed in Palestine. So did Jews, Christians, and others. No different than Syria where you have Christians, Druze, and Muslims living there as well. 

——

Of course the local Arabs, supported by other Arab Muslim countries did not want to see a Jewish state, no matter how large or small. They rose up against both the Jews and the British, and the Brits caved and reneged on their declaration, ultimately lying to both the Jews and the Arabs, and eventually waving the white flag on all of it as they felt they couldn’t please either parties. 

To be clear, they did however create other Arab/Muslim countries from this land, including Syria, Transjordan (now Jordan) and Lebanon for mostly Christians. So the Arabs got their state (Jordan) and the Christians got (Lebanon). The sticky part became giving the Jews their piece of the land as a state. 

Finally the UN decided in 1947-1948 on the partition plan, which the Jews accepted and promptly established the State of Israel. The Arabs refused, and instead had Egypt, Syria, Jordan, Iraq, Lebanon, Saudia Arabia, and Yemen (collectively the Arab league) decided to wage a war of extermination with the clear goal of destroying all of the State of Israel, and killing all the Jews. 

This was not a Palestinian war against Zionists. In fact, it is known as the First Arab-Israeli war, because at the crux was the goal of having no Jewish state at all no matter how large or small. 

The Jews by some miracle won this war against 5 massive modern militaries. Truthfully, it’s shocking seeing how most of the Jewish population were immigrants, farmers, or holocaust survivors. They had no Air Force at all, and mostly garbage WWI relics, but when the only alternative is the complete genocide of the Jewish population, something kicks in. 

———

This in a nutshell is the conflict and has always been the conflict: The right for Jews to have a State of their own in the region. Simply put: it is and has always been a conflict of existential right of existence for Jews. It has always been a war of survival… where Israel must win or it is gone. 

_____ 

The west has twisted this into a conflict about land, who was here first, settlements, oppressor vs oppressed and so on. But this has never been the case and still isn’t. Hamas wants all of israel. They have openly said so, and their actions on Oct 7 said so. Every Jew is a settler no matter where they live. 

The 1967 was was more of the same, and so was the 1973 war and all the terrorism in between. It is why the Palestinians have refused any offer no matter what for the last 70+ years. 

In fact, until 1964 the narrative was never “Palestinians vs Israel” but Arab vs Israel. This is because the local Arabs didn’t consider themselves Palestinians. The national movement of Palestine was created after Arafat visited the Soviet Union in 1964, and frankly was a brilliant move to rewrite history and build a PR machine that would change the entire story and conflict from israel fighting for survival to one where israel is suddenly the occupier and evil monster. 

The west in a way has fallen for the scam. The Nakba was retranslated from meaning “massive military defeat by the collective Arab armies” to “ethnic cleansing of some “Palestinian” nation. Ironically, this nation didn’t exist yet when “Nakba” was used until the late 60’s. Palestinians pre-israel more often referred to Jews such as the international Palestinian football team (all Jews), or much of the Palestinian media and arts. 

Nothing proves this more than the reality from 1948-1967. While the Jews did manage to survive and push back against the massive Arab armies, they did not control all the land. The West Bank + Jerusalem was controlled by Jordan, and Gaza was controlled by Egypt. Neither Jordan nor Egypt promptly created a “Palestinian state” nor did the UN or the western world call for one to be established. Heck, even the “Palestinians” didn’t rise up and ask for one. Why? If the entire conflict was always about Palestinians having a state, wouldn’t the first thing you do be to create one on the territory you already have and then maybe expand it when you attack next in 1967? 

Unless of course the entire goal wasn’t a Palestinian state to begin with… but one of destroying and killing all Jews. 

But to suit this new narrative Israel became the aggressor and the poor Palestinians switched from being just “Arabs” to some 5 million “refugees”. All the while of course being funded and supported by billions of Muslims across 50+ countries many who hold precious resources like oil. 70 years of attempted genocide by Arabs on Jews has culminated to the evil mockery of now trying to paste the label on Jews, when once again Israel experienced an invasion and is trying to fight back. 

In my view: I pity the ignorant, and to those who pretend to be educated I recognize that good old Jewish hatred is alive and well.  

To be clear: I am not arguing that Palestinians don’t deserve the right to self determination, or that they should be occupied. Back in the early days the idea of Zionism was to build a land for a people in a land without a people. Palestine didn’t have “a people” it had people. No one denies that. But the Palestinians werent a people and you won’t find any evidence of it at all as a nation. 

",https://www.reddit.com/r/IsraelPalestine/comments/1kxsxyb/the_great_big_lie_how_the_west_distorted_the/,2025-05-28 23:21:03,refugee,53
IsraelPalestine,We need to talk,"So for context, I am a non religious Jew, Gen-X, and although I was not born is Israel I lived roughly half my life there.



For a while now, I have been having many dozens of conversations in OmeTV, and I have to say - it is not for the faint of heart.



For some reason, 99% of the people I talk there are Muslims from all around the world.



Syrian, Iranian, Turkish, Kurdish, Lebanese, Palestinians and more. Many refugees or immigrants in Europe, many in their own countries.



OmeTV is a notoriously toxic place, and people - regardless of gender, race, religion or nationality - will typically start the conversation by yelling insults, may them be personal attacks on your appearance, or anything else they can think of (the sky is the limit, you won't believe their creativity).



The App will let people know where I am talking from, so when they see I am from Israel unsurprisingly they start yelling all types of slurs, pretty much what you would expect. Also very commonly, they will chant ""free free Palestine"".



For some reason, I don't get triggered by any of it, and I tell them as much. I ask them if they want to have a conversation with me, and I also preface stating that I respect them (my interlocutor) very much, I respect Palestinians and I respect Islam, despite our big differences today.



And here is where the magic happens: with a few exceptions, all of them transform and immediately show true respect back at me!



The very same people that yelled the worst things I could imagine at me moments ago, prove themselves to be really respectful when showed respect. This is a beautiful thing on its own right, and was incredibly surprising and revealing to me.



So at this point the conversation starts. And it's not about winning the argument and not even about convincing. It's about listening and being listened to. I don't get defensive when their views feel insulting. I gently explain how my own perspectives on that particular point differ from theirs. You would be mind-blown how often they actually agree with my view. Not because I convinced them or imposed on them, it's just that they have actually never heard another narrative, and when they do it actually makes sense to them.



We see people yell past each other all the time in the social media and it often feels we are doomed. It feels our divisions are unsurpassable, and the future is grim. But my experience in OmeTV (of all places) made me truly hopeful that we can talk indeed, no matter how far we are. It requires a lot of patience, introspection, humble conviction and above all: respect.



After more than 20 years feeling unhopeful that we can ever have any peace, my hope has been re-kindled.



But we need to talk.

  
PS: it's late now, so I probably won't be able to reply to comments, but I will do my best to address as many as I can in the near future.",https://www.reddit.com/r/IsraelPalestine/comments/1kxo7ur/we_need_to_talk/,2025-05-28 20:13:53,refugee,49
