subreddit,title,text,url,created,keyword,score
ukraine,Volunteering in civilian roles,"Hi,

I’m an American. When the war broke out, I was doing my bachelor’s in Vilnius, and knew immediately that I had to do my part to help Ukraine. I became a teacher, teaching English to some of the thousands of Ukrainian refugees who came into Lithuania. Now though, I’ve graduated and don’t have much to do, and most of all, don’t feel like I have a purpose.

I am desperately searching for meaningful work, and the most meaningful work I’ve done to date has been the aforementioned teaching job, helping Ukrainians. This is a theme I want to continue, and as directly as possible—in Ukraine itself if necessary. 

My question therefore is if there are civilian military support roles I could fill in Ukraine, as a volunteer. I don’t have any military experience, but I’m a pretty capable person when it comes to clerical work, teaching, writing, research, or outreach. Really, I’m open to anything. ",https://www.reddit.com/r/ukraine/comments/1m3vk73/volunteering_in_civilian_roles/,2025-07-19 14:54:55,refugee,61
ukraine,<3,"As a Polish person I just came here to tell you that your country is admired for standing up to Putin and the refugees from Ukraine have brought a lot of good here. The racists that give refugees shit clearly do not understand that our economy would have collapsed without Ukrainians, Belarusians and other immigrants.

Please know that you are most welcome here, you are our friends, co-workers, partners, neighbours. The xenophobes are a minority, they just shout the loudest.",https://www.reddit.com/r/ukraine/comments/1lxfd29/3/,2025-07-11 21:03:10,refugee,540
ukraine,The Angry Ukrainian Syndrome: Injustice and Stereotypes About War and Peace,"I found this useful for understanding my own biases, and I think it could be very useful when discussing the war with liberal minded folk like myself. I've run it through an AI translator that I think did an excellent job.

Original: [https://trafo.hypotheses.org/52570](https://trafo.hypotheses.org/52570)

English translation:

  
  


The Angry Ukrainian Syndrome: Injustice and Stereotypes About War and Peace

  


  


By Olena Komar

  


In this article, I demonstrate a series of biases against Ukrainians in Western countries, which I call the “Angry Ukrainian Syndrome” (by analogy with the “North African syndrome”). These prejudices have emerged due to how Ukrainians speak about the war and how they are perceived in connection with Western European stereotypical expectations. Furthermore, these prejudices have a colonial nature, stemming from an inability to see Ukrainians as an independent people, distinct from Russians. This bias is reinforced by historical short-sightedness, influenced by pro-Russian sentiment in Slavic studies as well as by pseudo-pacifism.

  


Pseudo-pacifism is the tendency of those not under threat not only to deny assistance to those facing annihilation under the pretext of not escalating violence but also to shift the blame onto the victims—denying them the right to self-determination and the capacity to make informed decisions about their fate. These prejudices are also a form of epistemic injustice, which must be confronted by rooting out ignorance. Such ignorance can be intentional, serving the interests of the oppressor by sustaining misunderstanding of the experience and suffering of the oppressed.

  


There are several levels of epistemic injustice:

  


1. Stereotyping Ukrainians’ struggle for survival and identity as a manifestation of belligerence;
2. Rejection of war as a negative phenomenon is projected onto war victims—their experiences and emotions become unwanted. This leads to silencing or victimization;
3. Injustice of testimony and gaslighting result from “blind spots” in people’s knowledge: a distrust of Ukrainians’ accounts and understanding of their own history and of Russians;
4. Unjust equalization, coercion into peace and compromises that benefit only the aggressor.

  


  


  


Negativity or Resistance to Oppression?

  


  


A Ukrainian athlete refused to shake hands with a Russian athlete, Ukrainian writers declined to participate in a joint panel discussion with a Russian writer, and Ukrainian scholars protested against the idea of delegates from Russian universities participating in a conference.

  


How do Western Europeans react to such news? Do they view these actions as legitimate, just, reasonable? Most often, such events escalate into scandals, and the Ukrainians involved are accused of xenophobia, racism, or nationalism, cruelty, aggression, and discrimination, because Ukrainians distrust talk about peace negotiations, refuse to build “bridges of friendship” between intellectuals, and their statements are interpreted as hate speech.

  


Is there something wrong with the Ukrainians themselves and how they deliver their messages? Or is the problem on the side of the listeners, in how they perceive these messages and their trust in the speakers? I want to draw attention here to the latter.

  


The stereotypical perception of Ukrainians as angry, aggressive, belligerent, and perpetually dissatisfied plays into the hands of Russian propaganda, which tries to portray Ukrainians as simply “bad Russians.” In my opinion, without a proper understanding of hermeneutical injustice, the harm caused is likely to grow—reinforcing the formation of what I call the “Angry Ukrainian Syndrome.”

  


  


What Are the Preconditions for This Argument, and Where Does the Term Come From?

  


  


I use this term by analogy with the one used by Frantz Fanon, who introduced the “North African Syndrome” in his essay of the same name. This is not a medical diagnosis but a prejudice held by French psychiatrists toward North African inhabitants. Modern science recognizes this syndrome as a manifestation of racist colonial bias—under which North Africans were seen as lazy or overly emotional.

  


This viewpoint did not necessarily stem from malice on the part of individual doctors, but rather from stereotypical perceptions of Africans as mentally inferior and emotionally unstable—perceptions shaped by colonial attitudes. This bias arose unconsciously as a result of institutional instruction—but does that absolve the doctors from responsibility for their own ignorance?

  


Modern science considers such ignorance blameworthy and irresponsible because, first, it could have been avoided and corrected through proper epistemic conduct, and second, it harms others and therefore is not innocent.

  


Many studies have been devoted to decolonizing knowledge and to the concept of “white optics” or “white ignorance,” which allows one to “not see” numerous discriminatory manifestations.

  


And yet there is still no clear understanding of the place of white Slavic peoples in Europe, who for much of the last few centuries have been more oppressed than oppressors.

  


  


The Lack of a Hermeneutical Perspective Toward Ukrainians

  


  


The absence of a hermeneutical perspective regarding Ukrainians as Eastern Europeans who, for most of their history, were enslaved, restricted in rights, oppressed, or engaged in struggles against attempts at genocidal extermination has extremely harmful consequences for understanding the present-day Ukrainian condition.

  


Imposing a Western European optic onto Ukrainians leads to dramatic distortions because Ukrainians historically have been neither a privileged part of the Western world with its colonialism, nor do they identify with the “Russian world” and its imperial ambitions.

  


Anti-colonial and anti-racist criticism also often misses the mark, since Ukrainians are not “white privileged oppressors.” Therefore, accusations of racism for helping Ukrainian refugees—which are often inflamed by Russian propaganda abroad—are deliberately divisive messages.

  


At the same time, Ukrainians have never been perceived by the West as a distinct oppressed community, because they were viewed only through the Russian colonial optic as “the edge of Russia” or as “Little Russians.” This was reinforced by both the Soviet myth of the equality of brotherly republics and the Russian myth of the “younger brother.” The current rhetoric of the Russian regime toward Ukrainians is even worse, consisting of the total denial of Ukrainian subjectivity—as “bad Russians” or even as a “virus.”

  


As a result, Ukrainian identity is extremely blurred in the Western European focus, and in many aspects—including language—there is a blind spot. For example, refugee assistance centers abroad default to offering help from Russian-speaking interpreters. This has led to Ukrainians becoming invisible and unheard in their uniqueness, and being perceived with prejudice or mistrust, while their epistemic status has been downgraded.

  


Since many Europeans are only now encountering Ukrainians personally for the first time, they often generalize and stereotype based on these interactions. This may give the impression that most Ukrainians are dissatisfied, negative, belligerent, and intolerant. But today’s image of Ukrainians is being shaped by the extraordinary circumstances of resisting an invasion—and by the world’s inadequate response to it—not by any “natural state” of Ukrainians themselves.

  


  


Bravery or Belligerence?

  


  


At the beginning of Russia’s full-scale invasion of Ukraine, social media and lightboxes in European, U.S., and Canadian cities were flooded with the slogan: “Be brave like Ukraine.” The world was amazed by the courage with which Ukrainians resisted an enemy whose territory is over 28 times larger, whose population is five times greater, and whose military is the “second-largest army in the world,” equipped with nuclear weapons.

  


Yet even this slogan faced criticism, with some saying it “normalizes” and “encourages” continuation of the war—something Europeans hoped never to see again. It’s easy to ignore a war in the center of Europe: just close your eyes to the Ukrainians who have brought their misfortune with them—or blame them for what’s happening.

  


  


A Personal Anecdote

  


  


“My son, age 10, visibly tenses when I suggest adding a slide with a photo of the destroyed museum to his school presentation in Vienna about the Ukrainian artist Mariia Prymachenko. On February 25, 2022, the museum in the town of Ivankiv, which housed a collection of the artist’s paintings, was destroyed by the Russian army during their advance on Kyiv.

  


Of course, Austrian teachers and students will love Prymachenko’s fantastical animals, birds, and flowers—works admired by Pablo Picasso. They are colorful and joyful. But why should they see that the artist’s museum was destroyed by Russian soldiers? They might not even like that you mention “Russian”—there’s a Russian student in class, it might make him uncomfortable, and that could be labeled as ‘xenophobia.’”

  


Even a young child in primary school quickly learns that Ukrainians with “their war” do not fit the standards of pacifist countries—especially German-speaking ones.

  


Are our feelings forbidden? Of course not. Are they unwanted? Absolutely. Silencing doesn’t require coercion. The victim silences herself—having lost hope of being heard or fearing condemnation.





  


European Pacifism and the Rejection of Ukrainian Pain

  


  


The pacifism of modern Germans and Austrians—their rejection of nationalism and aggression in any form—has a clear historical basis: a desire to forget and cleanse themselves after World War II from the image of a nation burdened with collective guilt for Nazi crimes or, at the very least, for their failure to resist evil.

  


Those who, more than anyone, should understand what Ukrainians feel today—once again victims of aggression—prefer not to reopen wounds of memory, even if that means ignoring the destruction of Ukrainians.

  


But there is a huge difference between renouncing the idea of attacking other countries and denying others their right to defend themselves by any means available when they are attacked.

  


  


“Kriegmüde” – War-Weary

  


  


“Kriegmüde” (literally “tired of war”) is a new German word I learned from a letter from another school. Europeans are tired of the war, of high prices, of helping refugees, and they ask us: “When will there be peace? Why don’t Ukrainians compromise?”

  


But can Ukrainians afford to be tired of the war? Do they keep talking about it because they want it to continue?

  


Si vis pacem, para bellum — “If you want peace, prepare for war.” Peace will come through justice, not through compromise if that compromise is rotten.

  


According to Professor Margalit, author of On Compromise and Rotten Compromises, those compromises that preserve a regime of cruelty and humiliation are morally unacceptable—even in the name of peace.

  


  


This Isn’t the First Time the West Has Looked Away

  


  


This is not the first time in world history that Western Europeans have not wanted to know about the destruction of Ukrainians by Russians.

  


At present, “peace” for Ukraine on Russian terms means slow, systematic extermination, as has happened in previous periods of history. In his 1983 essay The Tragedy of Central Europe, Czech writer Milan Kundera—himself exiled because of Soviet aggression—criticized Western Europeans for not valuing what other Europeans were ready to die for.

  


He wrote:

  


“One of the great European peoples (almost forty million Ukrainians) is slowly disappearing. And this immense, nearly unbelievable event is taking place, and the world does not notice it.”

  


  


  


  


Allies Stabbing in the Back

  


  


Ukrainians are genuinely angered and frustrated by a number of topics related to false or misguided support from allies—especially when these same allies simultaneously express support for supposedly “good Russians” or try to build “bridges of friendship” with them.

  


Since the start of the full-scale war in 2022, many Western institutions—including universities and academies—have issued public statements that repeat the phrase:

  


“We support Ukrainians and brave Russians who oppose the war.”

  


But this seemingly inclusive language is deeply flawed. First, it equates the aggressor and the victim. Second, it places the virtue label “brave” on Russians, while Ukrainians are merely pitied as victims. Third, it often borrows Ukrainian symbols to promote Russian Studies, which many Ukrainians perceive as an act of appropriation.

  


Even if well-intentioned, these gestures often backfire. Ukrainians feel betrayed, silenced, or spoken over. This is a form of gaslighting—and as scholar Rachel McKinnon explains, betrayal by an ally hurts especially deeply. It is compounded by “westsplaining” and “russsplaining”: imposing Western or Russian colonial views on Ukrainians, who are framed through Russian-dominated academic lenses.

  


  


  


  


False Equivalence and Real Injustice

  


  


A disturbing example: the Finnish Migration Service housed Russian men avoiding mobilization in the same shelters as Ukrainian refugee women and children. This was traumatic and dangerous for the Ukrainian women—but it stemmed from an epistemic blind spot, a refusal to differentiate between the oppressed and the complicit.

  


This kind of moral flattening continues in many forms:

  


* Demanding Ukrainian victims engage in panels with “brave Russians”
* Framing the war as a “family conflict”
* Calling for equal dialogue between an aggressor and their victim

  


  


Such gestures are not neutral. They entrench injustice. Real justice means amplifying Ukrainian voices, prioritizing the needs of the oppressed, and resisting narratives that “both-sides” the war.

  


  


  


  


What Real Parity Requires

  


  


Equal negotiations cannot occur until:

  


1. Full cessation of aggression and guarantees against future attacks
2. Compensation for historical discrimination
3. Transformation of social structures to eliminate injustice
4. Affirmative support for the voices of the historically oppressed

  


  


Only then can genuine parity be discussed. Otherwise, reconciliation efforts only entrench discrimination and deepen epistemic injustice.

  


  


  


  


Conclusion

  


  


The literature on decolonizing knowledge and epistemic injustice is relatively new. Yet Ukraine remains almost a tabula rasa in that discourse.

  


Western Europe faces a historic choice:

Either to finally discover the real Ukraine—

or to unwittingly assist Russian propaganda in cultivating the “Angry Ukrainian Syndrome.”

",https://www.reddit.com/r/ukraine/comments/1liolxd/the_angry_ukrainian_syndrome_injustice_and/,2025-06-23 20:38:06,refugee,227
ukraine,"I wrote this letter to my representatives in congress, urging immediate action to prevent Trump from undermining Ukraine and our allies. Please feel free to use this as a template and contact your representatives!","**Find your representatives here:** [**https://www.commoncause.org/find-your-representative**](https://www.commoncause.org/find-your-representative)

  
**Subject: Urgent Action Needed to Prevent Trump from Undermining Ukraine and our NATO allies.**

**Dear \[Representative's Name\],**

I am writing to express my deep concern over reports that Donald Trump may attempt to bypass our NATO allies and pressure Ukraine into an unfavorable settlement with Vladimir Putin. Such a maneuver would not only betray our commitment to Ukraine’s sovereignty—it would corrode U.S. credibility and embolden authoritarian regimes worldwide. The stakes could not be higher.

Ukraine has demonstrated extraordinary courage in the face of unprovoked Russian aggression. Our NATO allies have stood resolute alongside them, affirming the principle that free nations have the right to chart their own destinies without coercion. Any attempt to force Ukraine into a deal on Putin's terms would strike at the heart of democracy, international law, and the collective security architecture the United States helped build and lead.

That is why I urge you to take immediate and decisive action to prevent any unilateral moves—by Trump or anyone else—that might compromise our alliances, appease authoritarianism, or undercut global security. Specifically, I ask you to:

1. **Publicly reaffirm the United States’ commitment to NATO and to Ukraine’s sovereignty.** It is essential we send a clear, bipartisan message that America keeps its word—and stands with those who defend freedom.
2. **Support legislation that strengthens congressional oversight of foreign policy,** preventing any administration from bypassing allies or making backroom deals that endanger global stability.
3. **Advocate for sustained and expanded military and economic aid to Ukraine,** including lifting any remaining restrictions on the delivery of long-range weapons systems. Ukraine must negotiate from a position of strength—not while one hand is tied behind its back.
4. **Impose new, robust sanctions on Russia,** targeting sectors that continue to bankroll its war machine and signaling that aggression will be met with escalating consequences, not diplomatic reward.
5. **Champion legislation that protects Ukrainian refugees and asylum seekers,** particularly in light of Trump’s radical anti-immigration agenda. No one fleeing Putin’s war should be subjected to deportation or bureaucratic purgatory in the United States.

The American people overwhelmingly support Ukraine’s fight for freedom. We cannot allow political expediency or authoritarian nostalgia to erode that support. History is watching—and the cost of appeasement is always paid in blood.

Thank you for your leadership and commitment to democratic values. I look forward to your response and to seeing bold, principled action on this issue.

**Sincerely,**

\[Your Name\]",https://www.reddit.com/r/ukraine/comments/1lfqv6t/i_wrote_this_letter_to_my_representatives_in/,2025-06-20 02:45:54,refugee,128
ukraine,Looking forward - would love to hear ppl's thoughts on eventual reconstruction,"Sorry for the vague question, but I only have a vague understanding. Appreciate any input!

I started following Ukraine/Euro news at the start of the war and I'm looking for others' thoughts to deepen my admittedly simplistic view. Would also love accessible resources (podcasts, YT) that go into this regularly. I mostly rely on the Times radio show which is more present/retrospective, not future-oriented.

From everything I've seen it looks like Ukraine is could be poised to become the next Poland, socially/economically once Russia collapses (god willing). Obviously there are big challenges (population decline, corruption, etc.) but I'm saying the potential is there.

My thinking is like this:

Europe knows Ukraine is its best defense against future Russian activity, so it's reasonable to expect extensive aid incoming. The war (in my understanding) has already done a lot to bring Ukraine closer to western Europe in terms of tech, culture, and training. The gov. has been working closely with EU monitors to bring their legal code/corruption standards up to par.

The Ukrainian ppl themselves are unified in a way most countries never experience - they've been actively fighting against Russian influence for more than a decade at this point. I know there's a lot of internal bickering but on the big issues it seems like everyone is on the same page.

Foreign investors would love comparatively cheap, educated labor as long as they felt secure there. And I feel like Ukraine has a strong understanding of western business culture, and the ppl are educated and tech-savvy. The returning refugees also have the potential to bring additional connections, etc. 

**So what might be some serious or interesting challenges? Opportunities?**

For example, I recently learned that a lot of the farm land is in some kind of legal limbo due to soviet-era collective ownership. Sorting that out alone seems like both a huge hurdle and opportunity.

Would really love to hear any thoughts. And if I'm mistaken/dumb, please correct me.",https://www.reddit.com/r/ukraine/comments/1kv8pul/looking_forward_would_love_to_hear_ppls_thoughts/,2025-05-25 19:56:51,refugee,14
ukraine,I’m worried for my Ukrainian friend who is scared she’ll have to return to the Ukraine and leave the UK,"hello, 
I’m not Ukrainian but my friend is. I’m not sure this is the right sub for this topic but I didn’t have a lot of luck in the UK subs (due to anti immigration views taking over reddit), so if you think this is the wrong sub Id appreciate direction on where to post this.

I have a colleague who has become a good friend of mine who is struggling right now with her immigration status in the UK. 
She is Ukrainian, from West Ukraine (not sure where exactly right now but can provide this info at a later time when I asked her). She came here 3 years ago via the Ukraine Scheme when her area in Ukraine was deemed as risky. She has a good and secure job here now, a partner and a life. 

About 6 months ago she was excited because she received the news that this kind of refugee visa has been extended for another 2 years after her expiry date which is July 2025.

However, recently she told me that news broke of changes within the scheme which wouldn’t grant her an automatic 2 year extension. She’d now have to apply for it to be extended for another 1.5 years, and that is if she will even be accepted for extension. The area she is from has been deemed as “non risk” by UK immigration. Which is not true for the actual residents living in her city, as her sister is still there with currently no electricity in a really harsh winter.

I am worried for her to be sent back to the Ukraine as it is simply not safe, despite what immigration says. She built up a life here and has made use of her time here. It’s so unfair.

After she told me about all of this, we discussed her options. She is currently working in a good position within the hospitality industry with a good salary. However, this job would not qualify for a working visa. Our boss likes her and said he could apply to be her sponsor so she could get the working visa, although this is a long and expensive process which in the end could all be for nothing if it was rejected in the end. 

She was thinking of going to University to get a student visa and then go the legal work visa route to stay in the UK, but that wouldn’t be possible if she will be refused for an extension on her current status as she needs the time to make all this happen.

She is going to apply for the 1,5-year-extension this summer however she’s worried as she read that many Ukrainians have been refused. a friend of hers from the same region has been accepted for the extension. the friend doesn’t speak english and we are unsure what are the requirements to be accepted for it. 

Has anybody dealt with similar when looking for refuge? how are you guys dealing with this and if there are any Ukrainians in the UK here, what would be her best course of action in this? I really want her to stay in the UK. ",https://www.reddit.com/r/ukraine/comments/1kp2cmp/im_worried_for_my_ukrainian_friend_who_is_scared/,2025-05-17 22:21:53,refugee,39
