subreddit,title,text,url,created,keyword,score
IsraelPalestine,UNwatch,"an invitation for you to watch the UN instead of watching their hands point towards jews, once you pay attention then the magic show isn't as captivating

actually there is a organization called UNwatch, here are some wonderful examples of their articles:

https://unwatch.org/issue-647-u-n-elects-qatar-congo-pakistan-top-rights-body-u-s-pulls-unesco/

https://unwatch.org/issue-637-u-n-report-israel-blame-palestinian-men-beating-wives/

there is a lot more where it's coming from so don't worry.

but regarding the israeli palestine issue and why the UN as a body is worthless, besides being worthless they have also picked a side so they can't be used as a non biased source, here are some key facts for those who still pretend the UN is some kind of ""peace keeping"" body

UNRWA was founded in 1949, long before the so called ""israeli occupation""(1967) that the moderate pro ""Palestinians"" claim is the sole reason for the conflict:

UNRWA is an organization whose purpose is to prolong the Palestine conflict until it's resolved in the desired way(israel is destroyed)

I'm not talking about recent stuff regarding co-operation with hamas 

https://www.unrwa.org/newsroom/press-releases/unrwa-condemns-placement-rockets-second-time-one-its-schools

I'm talking about it's inherent purpose for existing, the UN has 2 agencies for refugees, one for the Palestinians(UNRWA) and one for the rest of the world(UNHCR)

UNHCR:

The primary purpose is to safeguard the rights and well-being of refugees globally. 
UNHCR works with refugees, asylum-seekers, and internally displaced people, regardless of their origin, aiming to ensure they can exercise their right to seek asylum and find safe refuge. 

UNHCR determines that a person is no longer a refugee through a process called cessation of refugee status, based on Article 1C of the 1951 Refugee Convention. This happens when international protection is no longer necessary or justified due to changes in the refugee’s circumstances or in their country of origin

UNRWA: 

Operates within the specified geographic areas, providing direct services to Palestinian refugees. 
Areas of Operation:
Jordan, Lebanon, Syria, the West Bank (including East Jerusalem), and the Gaza Strip. 

Defines and registers Palestine refugees based on a unique mandate:

Those who lived in Palestine between June 1946 and May 1948 and lost homes/livelihood due to the 1948 conflict.

- Hereditary refugee status: Descendants of male Palestine refugees can inherit refugee status, even generations later, which prolongs the conflict for eternity and increase the number of refugees regardless of their conditions(yes, even Palestinian billionaires are refugees) until they can return to ""their"" lands of before the 1967 borders, which means displacing Israelis 

so we can clearly see the UN goal of creating UNRWA.

there is another key factor which blatantly shows the UN hateful agenda against israel- their support for the PLO.

the PLO was founded in 1964, also before the so called ""occupation"", and obviously they started attacking israel instead of trying to gain independence under the rule of egypt and jordan(and it's not like ""Palestinians"" haven't attacked israel before 1964)

the PLO goals are the destruction of Israel:

The original PLO Charter (Palestinian National Covenant), particularly the 1968 version, called for the destruction of Israel and rejected its legitimacy.

What the Charter Said:
- Article 9: Declared that armed struggle is the only way to liberate Palestine, making it the overall strategy.
- Article 15: Called for the elimination of Zionism in Palestine, which many interpret as a euphemism for dismantling the State of Israel.
- Article 19: Stated that the establishment of Israel is entirely illegal, regardless of time passed.
- Article 22: Described Zionism as a racist, imperialist, fascist movement and Israel as its instrument.

Attempts to Amend the Charter:
- In 1996, the Palestinian National Council voted to amend the Charter to remove clauses inconsistent with the Oslo Accords, which included recognizing Israel.
- However, the vote did not meet the required two-thirds majority to formally amend the Charter under its own rules.
- In 1998, Yasser Arafat held a symbolic assembly with President Clinton present, where participants raised hands to support a letter claiming the offensive articles were nullified—but no formal legal amendment was made.

The Palestine Liberation Organization (PLO) has not been formally condemned by the United Nations in a direct resolution. In fact, the UN has historically recognized and engaged with the PLO in several significant ways:

key UN revolutions regarding the PLO

1. Resolution 3210 (1974) – Invited the PLO to participate in General Assembly discussions on the question of Palestine.  
2. Resolution 3236 (1974) – Affirmed the inalienable rights of the Palestinian people, including self-determination and the right of return.  
3. Resolution 3237 (1974) – Granted the PLO observer status at the United Nations.  
4. Resolution 3375 (1975) – Called for the PLO to participate in peace efforts in the Middle East.  
5. Resolution 43/177 (1988) – Acknowledged the proclamation of the State of Palestine and changed the designation from “PLO” to “Palestine” in the UN system.  
6. Resolution 67/19 (2012) – Upgraded Palestine’s status to a non-member observer state, reaffirming the PLO’s role as its representative.

so can anyone look at this and then say the UN is a non biased in this conflict? i didn't even mention anything too specific so you won't claim ""cherry picking"", like their star they love to show off and defend- the nutjob Francesca albanese",https://www.reddit.com/r/IsraelPalestine/comments/1m2jcgu/unwatch/,2025-07-17 23:05:09,refugee,25
IsraelPalestine,Ahmed Fouad Alkhatib on what it means to be pro-Palestine,"I thought I'd share this as it's one of the best and most balanced takes on the conflict I've seen.

**What being pro-Palestine means to me / my platform:** I'm passionately, unequivocally, and without hesitation, a proponent of the Palestinian people’s just and urgent aspirations for self-determination, liberation, sovereignty, and safety. I grew up in Gaza, where I experienced Israeli violence and bombardment, including one incident that almost killed me and caused me permanent hearing impairment; my family is still in Gaza and has suffered dozens of deaths during this latest war; my grandparents were expelled from their ancestral homelands in 1948 and fled to the Gaza Strip; and my parents were raised in a refugee camp in Rafah during the 1950s. This background informs and influences me and speaks to why I care about the Palestinian issue and consider myself pro-Palestine. I am motivated by a sincere desire to see my people obtain their legitimate and undeniable rights, which they have not had for decades.  
  
Yet I, and many others, especially those who are silent or are forced to be quiet, struggle with finding a political home in today’s pro-Palestine movement. Increasingly, it feels as if pro-Palestine activism is dominated by maximalists (wanting all of historic Palestine and other zero-sum positions and approaches), slogan-driven voices, and narratives. There is a lack of pragmatic and humanistic ability to hold multiple truths at once and to advocate nuanced and color-rich positions and views that are not black-and-white depictions and understandings of the Israel and Palestine conflict.  
  
**Here’s what, to me, an effective and meaningful pro-Palestine platform entails:**  
  
**1.** Supporting the right of Palestinians to a sovereign and independent state living in peace side by side with Israel.  
  
**2.** Condemning Israeli government actions, policies, priorities, and decisions that kill, harm, undermine, or oppress the Palestinian people.  
  
**3.** Criticizing and decrying the conduct of the war in Gaza, the military occupation in the West Bank, and the Israeli government’s disregard for Palestinian civilian lives, and the destruction of property and cities.  
  
**4.** Rejecting, denouncing, and exposing the theft of Palestinian lands in the West Bank and the sprawling settlement enterprise and settler violence.  
  
**5.** Supporting highly targeted, specific, and effective sanctions against individuals, groups, and entities that are enabling the unjust and illegal occupation of the West Bank and harming Palestinian civilians.  
  
**6.** Denouncing and combating the dehumanization of the Palestinian people or the denial of their existence as people with the right to live on the land they called home for generations.  
  
**7.** Acknowledging the tragedy experienced by hundreds of thousands of displaced Palestinians from 1948 and giving them/their descendants the right to return to the lands of a future Palestinian state in the West Bank and in the Gaza Strip.  
  
**8. Understanding past and contemporary mistakes that have set the Palestinian people back by decades and made them pawns in ideologies and geopolitical programs, agendas, and designs.**  
  
**9. Developing a pragmatic and realistic framework for recognizing Israel’s existence, right to exist, and the inevitability of its continued existence, all of which should inform how a solution is approached.**  
  
**10. Dispensing with delusional and destructive elements of the Palestinian narrative and acknowledging that there will not be a full liberation of all of Palestine, there will not be a right of return to what is now mainland Israel, and that Israel cannot and should not be confronted militarily or through any form of violence.**  
  
**11. Promoting a cultural shift away from revolutionary rhetoric, martyrdom, and armed resistance, and instead, rebranding coexistence and peace as a courageous and necessary evolution to preserve Palestinian lives, lands, and heritage and foster a new generation of nation-builders who are focused on doing the most with what the Palestinians currently have and can have in the West Bank and the Gaza Strip.**  
  
**12.** Denouncing and rejecting antisemitism while also acknowledging that Zionists and Israelis are a diverse group/people and that the Palestinians have to work with all of these segments to have sustainable coexistence and peace.  
  
**13.** Understanding how violent/hateful rhetoric, actions, and mistakes are detrimental because they empower right-wing and extremist forces in Israel who are opposed to Palestinian rights and that persistent mistakes and incendiary rhetoric and proclamations erode support for the Palestinian people and cause.  
  
**14.** Recognizing Palestinian agency, responsibility, and accountability when taking actions that have negative consequences and outcomes and acknowledging that, while there’s an asymmetry of power dynamics, Palestinian leaders, political groups, and prominent figures should make rational and responsible choices to optimize for better prospects.  
  
**15.** Accepting that even with East Jerusalem as the capital of a future Palestinian state, access to holy sites must always be shared and open to all.  
  
**16.** Realizing how nefarious regional players like the Islamic Republic of Iran and its proxies are not sincere or helpful allies to the Palestinian people and have done so much damage to the entire region and the Palestinian cause.  
  
**17.** Developing the capacity to hear Jewish perspectives and grievances, historical and contemporary, to understand why pro-Israel supporters believe what they do and why Israel means so much to so many, even if one disagrees with those opinions and views.  
  
**18.** Understanding that Hamas recklessly endangered Palestinian lives and placed the people of Gaza in significant harm and that the group relies on Palestinian suffering as part of its strategy to delegitimize Israel globally while perpetuating the conflict without any meaningful resolution.  
  
**19.** Registering the dangers of Islamist rhetoric and ideology that seeks to Islamize Palestinian society and to turn the Palestinian national project into a religious one in pursuit of an Islamic state that, by default, will be exclusionary and incapable of accommodating diverse residents in a future Palestinian country.  
  
I am compelled to share the aforementioned because, for far too many people, pro-Palestine activism has been reduced to incendiary language that fails to capture the multiple moving parts of what is needed to advance the just and urgent Palestinian aspirations for freedom and independence. While many students, activists, advocates, academics, and analysts have their hearts in the right place, many cannot present viable and pragmatic ideas that are not mere rhetorical statements and empty slogans.   
  
I know that many strongly disagree with my views and opinions, and that’s entirely fine. Still, many more are eager to see a recalibration of pro-Palestine activism to actually help the Palestinians achieve statehood instead of inflaming division and fostering hostility towards supporters of Israel and the Jewish community. Many in Palestine are aware of the need to be pragmatic and don’t think that angry protests, BDS, antisemitism, endless academic lectures, social media activism, or “feel good” slogans will actually make a difference.  
  
**It’s time for a rejuvenated pro-Palestine movement that serves as a big tent to encompass multiple views and opinions and to invite and promote broad alliances, especially with mainstream Jewish and Israeli communities, to work towards a just and sustainable resolution of the conflict once and for all. This is entirely attainable and achievable with humility, civility, patience, compassion and kindness, perseverance and determination, a willingness to accept reasonable compromises and accommodations, and, most importantly, the recognition of both sides’ undeniable and mutual humanity.**

  
[https://x.com/afalkhatib/status/1782241783843553568](https://x.com/afalkhatib/status/1782241783843553568)",https://www.reddit.com/r/IsraelPalestine/comments/1m06dpv/ahmed_fouad_alkhatib_on_what_it_means_to_be/,2025-07-15 04:44:49,refugee,102
IsraelPalestine,A quick history of the conflict where I point out the parts each side ignores,"When hearing a hearing of the conflict, I notice that both Israel and Palestine supporter tend to include about half the information and act like the other half didn't happen. So I'm making this so we can have a full list of what actually happened, including both sides' dirty laundry. I'll point out which stuff each side tends to ignore. If I miss a significant event, post it and relevant context (that means the stuff your the other side did to cause it).

**Ancient times:** Jews lived in ancient Israel and built kingdoms—pro-Palestinians often ignore this.

**Ancient times:** The ancestors of today’s Palestinians (Canaanites, Philistines, Aramaeans) lived in the Levant for millennia—pro-Israelis often ignore this.

**70 CE:** Romans destroy the Second Temple, expel Jews, and enslave and take many to Europe (these slaves become Ashkenazi Jews) and rename the land Palestine, a word that means ""invader"" in Hebrew, to humiliate Jews —pro-Palestinians ignore this

**634 CE:** Arab Muslims expell Jews from Arabia, conquer the Levant, Arabize local populations, and impose second-class dhimmi status on Jews. The ancestors of today’s Palestinians, now Arabized, are part of this sea of Arabs who persecute Jews for the next thousand years. —pro-Palestinians tend to ignore this.

**1516:** Ottomans conquer Palestine; local Arabs live under foreign rule for 400 years—pro-Israelis often ignore this.

**70–1800s:** Jews face repeated massacres, pogroms, expulsions, and legal discrimination throughout Europe and the Muslim world, including expulsions from Arabia, Spain, England, etc. and attacks in Ottoman Palestine. Israel remains the only home they ever had, while they are forced to wander as unwanted foreigners for centuries—pro-Palestinians often ignore this

**Late 1800s:** Zionism emerges as a Jewish national movement seeking return to Israel in response to antisemitism; Jews begin migrating to Ottoman Palestine —pro-Palestinians often portray this as European colonialism, ignoring the Jews are persecuted refugees who are indigenous to the Levant, and that Jews move to be subjects under Ottoman rule, not rulers themselves

**Early 1900s:** As empires fall, nationalistic movements (mostly local ethnic groups wanting to rule themselves rather than live under empires) start around the world. Arab nationalism rises with ambitions for control over the entire Arab world, including the Middle East and North Africa, while Jewish nationalism (Zionism) focuses on establishing a Jewish homeland in a small part of that region—historic Israel/Palestine. Both Arabs and Jews develop competing national identities that increasingly clash over the same land.

**1915–1916:** In the Hussein-McMahon letters, Britain promises Arabs control over most of the Middle East if they revolt against the Ottomans

**1917:** In the Balfour Declaration, Britain promises Jews a national home in Palestine

**1919–1923:** After WWI, the League of Nations grants Britain and France mandates over the Middle East: Arabs gain control over roughly 99.9% of the region (modern-day Iraq, Syria, Lebanon, Jordan, Saudi Arabia), while Palestine remains under British mandate

**1920s:** Arab militias start attacking, killing, and displacing Jews regularly. In 1929, Arab mobs massacre 67 Jews in Hebron and expel the rest; similar attacks happen in Safed and Jerusalem. Pro-Palestinians ignore this.

**1930s:** In response to the Arab attacks, Jews  build militias like Irgun and Lehi and retaliate, and you end up with Arab and Jewish militias fighting each other. Pro-Israelis ignore this.

**1941:** The Farhud pogrom in Iraq kills over 180 Jews and injures hundreds; in Palestine, Jews also face violent riots, reflecting wider anti-Jewish sentiment in Arab lands—pro-Palestinians often ignore this wave of anti-Jewish violence.

**1947:** UN proposes partition into Jewish and Arab states; Jews accept, Arabs reject and launch attacks.

**1948:** Israel declares independence; neighboring Arab states (Egypt, Jordan, Syria, Lebanon, Iraq) invade. Jordan occupies the West Bank, Egypt takes Gaza. Around 700,000 Palestinians flee or are expelled, while about 850,000 Jews flee or are expelled from Arab countries. Most Israelis today descend from these displaced Middle Eastern/African Jews. Jewish militias massacre Palestinian villagers at Deir Yassin, while Arab forces massacre Jews in places like Kfar Etzion and Gush Etzion. Arab armies besiege Jerusalem, causing starvation for around 100,000 Jews. In the end, Jews control Israel, while Jordan controls the West Bank and Egypt controls Gaza.

**1967:** After weeks of Arab military buildup, Egypt’s closure of Israeli shipping routes, and public threats by Arab leaders to destroy Israel, Israel launches a preemptive strike against Egypt. Jordan, Syria, and Iraq join the war. Israel defeats the Arab forces and captures the West Bank, Gaza, East Jerusalem, Sinai, and the Golan Heights—pro-Israelis call it occupying the places Arab armies used to attack Israel from, pro-Palestinians call it aggression, occupation, and expansion.

**1973:** On Yom Kippur (the holiest day in Judaism), Egypt and Syria launch a surprise attack on Israel. Israel is initially caught off guard and suffers heavy losses but eventually pushes back both armies

**1979:** Israel signs a peace treaty with Egypt, returning the entire Sinai Peninsula in exchange for recognition and normalized relations

**1987 & 2000:** Two Palestinian uprisings (First and Second Intifadas) involve widespread protests and attacks that result in thousands of Israeli deaths; Israel responds with security measures like checkpoints and barriers, leading to a significant decrease in attacks. Pro-Israelis emphasize wanting to not die in terrorist attacks, while Pro-Palestinians consider these security measures to be apartheid.

**2005:** Israel withdraws settlers and troops from Gaza; after Hamas wins elections and fires rockets at Israeli civilians, Israel imposes a blockade—pro-Israelis say Gaza is self-ruling and Jew-free as Gazans wanted but blockaded for security; pro-Palestinians say it remains under siege and occupation.

**2006–2023:** Hamas launches multiple wars to try and conquer Israel/ kill as many Israeli civilians as possible, Hamas fires rockets targeting civilians, Israeli strikes cause heavy destruction, and more Palestinians than Israelis die in the wars.

**Oct 7, 2023:** Hamas launches a surprise attack on Israel, massacring over 1,200 civilians—burning families alive, shooting children, raping women, and taking hundreds of hostages. It is the deadliest single day for Jews since the Holocaust. Around the world, mass protests erupt—but rather than condemning the massacre, many rallies celebrate it or blame Israel entirely. This marks the first time in history that a massacre was followed by global street protests either celebrating the massacre or condemning the victims, not the attackers. This causes Jews to fear a rise in global antisemitism. Pro-Palestinians tend to downplay or celebrate this, while Pro-Israelis tend focus on how these global celebrations of murdered Jews was a barbarity that had never occurred in history and made the anti-Jewish roots of the Pro-Palestinian movement obvious.

**Present:** Israel invades Gaza in response, killing tens of thousands of Palestinians, including many civilians, and causing a humanitarian crisis. Throughout the war, Hamas and Hezbollah launch tens of thousands of rockets at Israeli cities, while Iran and Yemen fire ballistic missiles—some intercepted by U.S. and Israeli defense systems. Pro-Israelis call it self-defense against terrorism and emphasize Hamas’s use of human shields and low civilian-to-combatant ratios; pro-Palestinians call it genocide and ethnic cleansing.",https://www.reddit.com/r/IsraelPalestine/comments/1lzzl70/a_quick_history_of_the_conflict_where_i_point_out/,2025-07-14 23:45:47,refugee,8
